,0
564,站中立是不想被任何网络牵着鼻子走，也没有支持公司的意思吧，你说这个话挺没意思的。
565,我叫真有病i：回复@吉生：其实你的语气也很阴阳怪气啦，但是真的很悲哀的是职场生涯就是如此，哪怕老板再阴阳怪气大多数人还是选择默不作声，毕竟刀没扎在自己身上。
566,吉生：回复 @我叫真有病i:我不针对层主的中立，我阴阳怪气的是那些阴谋论网友🙏
567,职场来讲老板在会议上确实有可能说过分的话，且录音也确实不对，在做人方面来讲，交给法官都比直接公布要道德，还有就是，在学校里，老师都可能被领导骂我就吃个瓜不站队，后续有证据就两个一起骂，至于现在先骂徐垃圾，反正攻击长相的话是说了
568,要有契约精神  打官司就是
569,中立不评价，因为不是当事人，你永远不清楚事实的真相，只需要在线吃瓜
570,有一说一 这层表面上说中立的 最后不都得来一句：yamy爆出来是借力” 录音不对” 这TM是中立？拉我进群？
571,而且3个月以前的录音拿出来现在发，不就很巧吗
572,杂食甜心：不巧啊，录音是三月份的，她本人拿到手就不知道是什么时候的了，而且三月份她的组合还没解散，可能还没规划好下一步吧，就算他是为了解约才公开，那我也觉得很合理
573,谁没被老板背后骂过？谁又没背后骂过老板。该解约解约，该赔偿赔偿。
574,吃瓜状态，看看就好
575,我背后骂我们老板被同事录下来发给老板那我是不是pua我老板了哈哈哈哈
576,亦是天晴：我老板为了赶货，经常叫我们加班。不愿意就走人，自然有人替代。我们也背后经常骂老板抠门光明顶。我怎么感觉这样会议商讨很正常。
577,开会的某种程度上录音算犯法的吧
578,杂食甜心：看法律判决，很多人离职闹上法庭都是靠录音证据才得以伸张正义的，一般泄露公司机密才会算违法
579,如果不是公司重大机密，就不会出道法律，再说x那样侮辱女性触犯道德了
580,热评看着难受
581,都0202年了 搞得还封建
582,那你她妈给谁道歉？大众？
583,什么风气不风气，以后有没有人敢签这家公司都是问题
584,冲你的头像 就不会骂你
585,艺人本身不是商品，但艺人这个身份就是商品
586,哎，yamy多大，徐多大?姜还是老的辣，才过一天就发了两份文档来洗，再过几天估计舆论就偏向徐了，yamy以后的路难走了
587,我们公司所有会议都要录音，还会有人做记录，以前我觉得这是形式主义，现在想想，这才是正常的公司吧。反而那些觉得公司开会就可以随意欺凌他人，且对方反抗就是不懂规矩的网友，你们怕是跪久了站不起来吧
588,中立也不行呗 层主也没要当艺人吧 就啥都能杠
589,说祝福层主的。我是不是也能说祝福遇到这种录你开会说话还曝光你的人？
590,我和你一样，事情一出我就觉得这女的真有心机，知道利用舆论压力，她以后除非自己成立工作室，要不谁签了她可要小心了
591,你这话表述就有问题，女性的天然优势是什么啊您告诉我
592,就跟门一样，有个什么事就叫什么门
593,不会吧，我也是
594,终于见到一个正常人的评论
595,还好能看到这么多冷静，头脑清晰的人
596,+1  这件事爆出来之前我知道有101但不知道yamy，完全是路人那种。我觉得吧解约的时候搞这个动作出来，除了本身的愤怒，也可能想利用舆论给公司施压让自己解约更顺利，还能收获一波好感。再者说句不好听的，职场上给老板打工的，有几个没被骂过？当事人如果够沉稳，就不会是这种处理方式
597,老板要是性骚扰你，你该咋证明不录音的话空口无凭谁信你
598,烨烨枫火照小池：回复@乖巧等待刀客特的小女孩：我回复的是1234那个昵称的，它是典型被职场pua的
599,乖巧等待刀客特的小女孩：我和你想的一样！这是保护自己的方式呀，必须留证据呀，要不然怎么证明自己被pua了，口说无凭呀
600,坚决站队，不然弱势群体怎么活
601,中立，等
602,大家表明自己的看法不是想当法官。对这个事件最为朴素的一种感觉，对不对另说，因为全部事实是怎么样只有相关人才知道，但是关于对艺人的不当言论，这个是事实。最起码的尊重底线，为什么大家不能谈。保持中立当然可以，完全没问题，这是自己个人的选择。但是一想到全部人都中立，突然脑袋疼。
603,既然你已经承认了是你说的话而且还道歉了尽管不是向yami，说明你也知道自己说的不是人话，你已经构成了侮辱，你就等着好结果吧
604,哈哈哈哈哈哈哈 为什么觉得这个老板很耿直哈哈哈哈哈哈哈哈哈哈语气又有点好笑 中年男人的倔强
605,在职场真的。。。录音很可怕
606,繁星归途016：回复@暴躁的小胡同学：而且更可怕的是，这个老板说的话其实不会存在法律问题。。。可以说主观想法，但职场录音是犯法的貌似，为什么偏偏在今天发出来
607,暴躁的小胡同学：是的 而且是积攒了3个月前的录音 老板可以起诉告密者
608,我只想问yamy这么做还会有公司会签她吗…3月份的事现在才爆出来？老板的言论不当 这么久才被爆应该就是为解约做准备吧 火少才刚解约
609,他这是又对网友pua了。。你们没感觉？？？pua给你的感觉就是这样的，你觉得他坏，唉他一说话你又觉得他可以了，远离pua珍惜生命
610,我现在觉得把工作归工作 不能议论每个人的观念
611,都不是善茬🍉🍉🍉
612,“会议本身与yamy无关”？？？你搞笑呢，一个老男人了，还不知道素质怎么写，真的是吐了
613,我也觉得中立
614,你这艾特我干嘛啦
615,感觉都是有心机的人。但是徐明超仗着自己是老板不尊重人的那番话真的恨了
616,同样中立，因为关于录音有侃爷和霉霉的前车之鉴。不站队
617,录音有错，在明确规定不能录音的情况下录音，属于非法录音
618,啊哈哈说的跟真的一样，你们女孩子一个宿舍一个办公室里有几个群心里没数，背后咋说别人的自己心里不清楚
619,说那屁话
620,我觉得艺人是商品，要不然怎么会有艺人的商业价值一说呢……
621,看到评论区的歧视女性我就知道事情不简单。
622,说句反调。这个徐老板，就是个典型的自我感觉良好，故意想”表现强硬”，喜欢给压力的那种老板。生活中这样的老板太多了，哪怕普通职员关起门来瞎说话的场景也每天都发生。的确让人厌恶，但也没有到互联网一边倒的声讨的地步吧？饭圈文化要是用到职场中，都这样弱不禁风，不如去喝西北风。
623,吃瓜群众
624,+1理性吃瓜，本来以为是最近几天的录音，原来是几个月前了，感觉不太好
625,我的天啊 才过了一天 舆论就朝徐那边倒了 资本力量真可怕啊
626,Emmm个人觉得公司内部的事情确实不应该拿到台面来说 开了先例有公司还敢要你吗
627,大家去吃浙大的瓜吧，娱乐圈的瓜随时可以吃，名校的得看时机了
628,一个公司的老板发生了这么尴尬的事件，而他公司的公关水平真的很一般
629,说得太对了，谁都录，用不用，怎么用，另说。
630,我觉得……都是成年人了……两边都居心不良……
631,职场玻璃心
632,加一
633,泰迷惑了，泰迷惑了
634,我也觉得 直接就被上升到不尊重女性 然后带动舆论 营销号一边倒这个已经很明显了有人在控制舆论 职场上老板就是老板 老板总不得像供祖宗一样供着员工吧 公司内部的事情又不是在媒体公众面前diss 况且Yamy的长相的确不符合大多数中国人对美的定义  火了之后反咬公司这事真见得多了
635,这事我站老板，说的都是事实
636,她有丶蠢
637,若在政府部门工作，你录音之后私自外放、那会承担什么责任？ 有什么事情不能私下解决
638,@小姚姚yiu
639,牛批，我寻思人家也没说错吧，诅咒嘴臭就开始了wb听风就是雨的🐶 nt确实多，见识到了
640,这个东西应该先走法律程序就吧，爆出来不就是想利用舆论？
641,杂食甜心：利用舆论是十恶不赦的做法吗？我遇到委屈的时候还想着告诉别人帮我一起骂人呢，省的这个姐解约了还要被骂白眼狼，她就算引导舆论没害人没违反法律为什么不支持啊，哪个社会实践不是引导舆论，没有舆论怎么有关注，怎么有反省
642,哪个员工没被老板骂过，我认为工资甚至包含了承受被骂的一部分，当然不能涉及人身攻击和骂家里人，其他的不是你的错也得受了，这是社畜的自觉吧
643,吃瓜就完了别瞎参与你们又不是当事人
644,吃瓜看戏
645,我们也不能忍，就喜欢看你倒霉，你继续牛啊
646,吃瓜看戏，都不是弱者，就看戏就好了
647,这里面，其它的我觉得都能保持中立，但是“变好看了就不是你了”，这句话真的有点问题吧？不否认作为艺人可能需要一些特质来加持自己的辨识度，但是“变好看了就不是你了”真的感觉读起来怪怪的
648,这就是自我保护 支持
649,是滴
650,明白人 一群吃瓜群众 帮助了一个 犯法的 无辜受害人 运用的是情理 处理法律
651,一个明星，挨了老板骂，有什么可围观的？自己没被老板骂过吗？
652,资本角度上毫无问题
653,@吃饱饭才有力气起名字 我也中立
654,吃饱饭才有力气起名字：我也是
655,天天被这帮戏精们搞的乌烟瘴气
656,你说出来我想说的，真特么勇敢！
657,垃圾玲花嫁给你就要被黑粉攻击了，傻子。
658,路人，一开始就有怀疑态度......毕竟咋们不是混娱乐圈的人，水深的很呦！
659,中立+1
660,这话说得，你是在现实职场中过得多不开心啊，我是去工作的不是去当间谍的，能干就干不能干就走呗，说实话职场中带录音的真的几乎没有，她这种明显就是利益纠纷吗，不要说得那么高大上
661,杂食甜心：回复@月海星辰-古：都是一个工作的成年人了，说这种话过过脑子吧亲
662,杂食甜心：回复@月海星辰-古：这是公然辱骂，只有当事人不在，这已经不是议论范畴的了，这就是实打实的语音侮辱人格侮辱语言暴力，你真的听了录音吗
663,月海星辰-古：回复@杂食甜心：按照你的说法每个人都犯法，谁没八卦过？
664,艺人本来就是经纪公司的商品，
665,虽然她长得不符合我觉得好看的审美，但是在开会这样说一个女艺人，本身这个中年男人有错在先。
666,哈哈哈终于有人站出来了，别的不了解不评论，但是职场规则不能破坏
667,+1
668,但是真的，确实chou啊！
669,不开心就离开，违约金按规则执行，挺简单的事情，搞复杂是为什么呢……钱呗
670,这种事情最怕反转反转再反转
671,女性的力量
672,一看主页粉丝啊，哦那没事了
673,害说了人家还理直气壮的不道歉嗯中年更年期男老板
674,我发现我特别理解徐老板，会不会被人骂。
675,➕1
676,心机girl和暴躁boss，两人挺配的。
677,我不赞成那位女明星的做法  发到网上   不要喷我
678,老圣母了……这是天然优势？？
679,我也是中立，谨慎吃瓜
680,谁对谁错，只有双方知道，各位就不要胡乱猜忌。
681,感觉徐老板说话的语气是个坦荡的人，包括yamy音频里发的话，也是想着解决问题吧，就是就事论事觉得yamy不好看，想开会解决感觉也是为了yamy好吧...
682,我也中立
683,这热搜直接把浙大的压下面去了
684,
685,我也是 总觉得这种一边倒的事情很容易有反转 所以不站队
686,加1
687,当然想好退路再爆录音不是很正常吗……难道还同归于尽鱼死网破？
688,我支持老板 这种风气不能忍
689,一个动机不纯，一个手段不纯，在这件事里，没有一个单纯是受害方。
690,我也中立。而且人家开会重点其实就是想帮助y成长的更好，甚至比y更了解到自己，公司肯定是希望她火的，展现她自己个性啥的
691,傻白甜人设最可笑了
692,只听事实不看狡辩
693,我已经好久不敢对热门事件发表看法了。我就搞不懂，为啥中立的也会被骂，被“祝福”。不知道那些人什么心态，一天激动个啥，非得别人跟他们一个立场才是好人似的。就感觉那些人很压抑，好容易被人激怒，有心理疾病似的。
694,这句话说的太对了
695,偷录和偷窃有什么区别 不站队 但是偷录那种明摆的垃圾
696,艺人就是商品喔，现在公司把员工当商品还是好的，大多数当包身工的吧！
697,不认识
698,Yamy  也不是简单的人。想解约  利用舆论  但 她毕竟 无论实力还是颜值还是舞蹈都一般……
699,明白人！
700,谎言不会伤人 真相才是快刀
701,我也中立！感觉艺人也不是啥省油的灯
702,其实Yami这样一搞，是自毁前程，合约还在徐那里，打官司是漫长的，这个过程足够拖死一个半红不白的艺人，网友都只是蹭个热度，热度过了，现实中要解决的问题还是得解决，所以啊，真的有点蠢！内心不舒服，音频可以爆，但应该是解约后，对前任秋后算账，顺便提升自己热度，博博版面利于接Job……
703,鶴児郎君：回复@木子诗羽：楼主说的没错，一时之快还是从长计议都是个人选择当然也应该相应的承担后果
704,木子诗羽：但就作为一个女性来说，长期遭受这种侮辱来说，谁都受不了吧
705,我也
706,我站你，也有点想站老板（我跑了）
707,所以是弱势者有罪论么？
708,本来大家都不知道这个老板背后说了她坏话，现在大家都知道了。我一朋友她说过一句话，别人在背后说你坏话你不及时反对，还过来告诉我你别人说你坏话了，那你还是别告诉我好了，知道了对两边都闹心。
709,中立 要想红有些东西就得受着吧 更何况是炒作 达到目的了
710,职场大多数是潜规则，都是大家默认和默默忍受的，从来都不对等，很多都不能拿台面来评判。敢拿出来说的都是勇士然后成了烈士。舆论一边倒不过是借机发泄职场情绪的网民，而枪打出头鸟这句话永远不过时
711,但是她这种人以后谁敢签？谁知道开会说了什么被她录音！都不是省油的灯
712,杂食甜心：正常公司都是看能力的，开会录音也是正常的，就你不是省油的灯，你去职场啥都不准备就等着被人吃
713,我也是！
714,我第一次看到的时候就表示中立了。
715,这事的关健不在于曝不曝光而是你说的那些话是人该说的吗，定位艺人的人设也不能侮辱人家啊，你家里没有女人吗
716,你的言语，很清晰地表明，你病了，内在病了，外面怎么也掩盖不住，最典型症状就是缺失了你自己提到的那个词眼：自我认知
717,天天向上的食色生活：回复@问风23：对的，难道他以为他在做慈善吗？还不是都是为了利益
718,黄跃娜5914N_gf：其实这个老板话里有那么一种“家长喊着：我就不该把你生出来”的味道，公司和艺人是利益共同体，娱乐圈的事情还是永远保持一种看客心态吧，生活里有童话，但更多的是现实，成年人的世界哪有那么简单。
719,问风23：其实这个老板话里有那么一种“家长喊着：我就不该把你生出来”的味道，公司和艺人是利益共同体，娱乐圈的事情还是永远保持一种看客心态吧，生活里有童话，但更多的是现实，成年人的世界哪有那么简单。
720,准备要入职场了吧，希望你不要被你的身材长相所左右
721,yamy？？？怎么念？？？鼻子里插根葱，装的是哪国的大象？？！
722,不无道理
723,这个老板说话难听 但的确对艺人定位还是准确的 艺人和老板脾性不对付 想解约都可以理解 但方式不对 你可以拿着录音去仲裁走正常法律流程 但绝不该用舆论解决问题  其实是模糊了自己的职业底线
724,同样，中立，吃瓜就好
725,我觉得第一她没有泄公司机密，第二一个男上司长期职场pua你你会怎么做？你会解约付违约金吗？还是把有利自己的证据收集好，准备离开？大概你会很大度吧我就做不到，我比较自私，我是那种别人打残我我也要撕掉他一层皮的人
726,早起加蜂蜜水：回复@暴躁的小胡同学：最后给又文盲又可笑的你普及一下法盲的意思：“法盲对自己承担的法律角色缺乏了解和责任感，法律意识极其薄弱，不能以法律自觉约束自己行为的人。有些法盲还自以为是，干涉相关的法律工作和正常的法律活动，干扰法律工作人员和教育人员的正常生活工作等。”这段话要是读不懂我也没办法救你了
727,暴躁的小胡同学：呵呵你好搞笑哦没人让她接受pua，解约就按规矩走，该赔钱就赔钱，3个月前的会议录音直接放到网上，除了拉点同情分对解约毫无益处，该赔还是得赔，而且私自把工作内容录音曝光是违法的，估计你是法盲吧。还有别把自己标榜成什么都要手撕的女侠，那样只会显得你又蠢又可笑
728,双方肯定都有问题，从舆论一边倒可以看出她确实占了这个优势，我也这么想的，但我觉得我会被骂，
729,老板要是送我10万，骂我两句也好像还是可以的。
