,0
291,只能说女的刚好想借这事拿观众当刀，都被牵着鼻子走
292,当然不能忍，可以跑路之后再刚，毕竟你的命脉把在别人手里胳膊拧不过大腿，除非你想好了退路，当然咱这行普通人的工作性质跟艺人还不一样，所以他们应该更复杂，不是你想的那么简单
293,老板碰到录音员工也惨
294,Liii1iiii：录音根本没啥，谁不得给自己留点后路，只要不把机密泄露，都不算啥大事
295,这女的怎么样我不知道，这男的不是好东西是肯定的
296,不会
297,没看出这群人对艺术有啥贡献
298,开会是不可以录音的，懂？？？
299,田燚F幼儿园园长：回复@杂食甜心：你以为你是记录员还奋笔疾书
300,杂食甜心：有法律规定吗？平时记录你们都奋笔疾书吗？
301,应了那句话，当浑浊变成常态，清醒就成了罪难道就是因为上下级的关系，现在的社交都这样，就该忍让吗，这本身就是错误的啊。
302,纯路人 我观点是 觉得两边都不是什么好东西。男的侮辱女性这点不对 但女的处心积虑为了解约现在放出开会录音 得到全网同情 又一次掀起微博网暴 网暴自己老板…要知道当时砸钱捧她出道还不是老板和公司吗…
303,“中立”一个词什么意思，懂吧？如果是自己喜欢的爱豆被骂，首先这个前提就是不是“中立”该有的了
304,我中立
305,艺人就是商品
306,加一
307,这个开会录音，聚餐录像，都什么毛病？毕姥爷，冯小刚让女演员跳舞，苏小明…
308,自信点儿，你是正常人，如丧考妣去骂人的简直是太了，
309,都不简单吧……
310,额～瓜吃下来，觉得都对也都不是什么好人
311,
312,我也是这种感觉
313,加我
314,感觉都不是好人，一个没素质？一个心机重？
315,反正老板是🐶🍺实锤
316,这好会啊这文章写的
317,嗐～这件事说明了啥～不要在不知道事情的真相前随风飘扬 
318,他这个会议内容就不是个能录音的内容，录了就算了，放出来不是折腾人？
319,看到评论我真实的震惊了。。。
320,受益终生
321,奶茶配蛋糕
322,很好！嗯，支持，支持
323,谢谢分享，支持下
324,这人是谁？
325,做人一定要真诚
326,做人一定要真成
327,会有机会的。
328,支持不道歉
329,我服了，第一次见把录音说的这么理所当然的
330,一个路过的网友啊：回复@杂食甜心：他这个会议他也说了是谈艺人问题的，要谈很多艺人的毛病和优点，开会之前也特地让人关手机了，结果有人把其中讲某个艺人的话剪辑出来，没头没尾直接放在网上，那特么肯定炸了啊。换谁都炸了啊。
331,杂食甜心：回复@一个路过的网友啊：？？录音都是针对老板的好吗，社畜斗得过老板吗？录音本身不是违法的事，你把公司机密泄露是违法，甲方乙方谈合同的时候也都会录音，开会记录也会开录音，至于这个明星算不算违法那是有法律解决，怎么非得出现个完美受害者才能思考上司pua这个问题呗，这么大的人上网不会客观看待问题吗
332,一个路过的网友啊：回复@杂食甜心：工作三年了哦你在职场碰到会录你音的同事，你受得了？
333,女性天然优势，有毒吧。按录音她老板未必有坏心，可能是想分析yamy的特点，突出她的优势，但是日常但凡碰到这样一个老板，大部分人都不大能接受。就是论事，为什么又扯性别。yamy方有利用舆论是真，但大众也绝不是因为她是女的就偏向她的。
334,不到真相大白，永远没有对错人总是会第一时间同情弱者，会被带偏的，比如那个苟晶打脸成啥样啊
335,为什么三月份的录音现在才公开
336,为了自己解约偷偷录音，细思恐极啊想走学学张雨绮，大大方方的嘛
337,会被骂   哈哈哈
338,别的都不说我就想知道女性的天然优势是啥
339,不会，因为我也中立，娱乐圈反转太多…
340,PUA这个词是不是烂大街了，什么事都冠名PUA
341,吃瓜观望
342,我和你的想法是一样的，毕竟这娱乐圈的水太深了
343,+1
344, 所以啊 现在真的是不敢看一看就随便站对了  
345,+1
346,观望就是给钱了？有啥毛病？
347,说实话 路人感觉Yamy可能也不是啥好东西...
348,水命妍霏：同感，看她的长相就不喜欢，欣赏不来.....
349,矮油，戴什么口罩？不要皿煮不要自由了吗！
350,不站队，但感觉两边都不是善茬
351,我觉得热巴也丑，怎么了
352,我想问一下，像yamy这样直接放录音啥的，虽然现在看着大家都站她这边，但是会不会其他经纪公司或者一些大boss之类的就会很排斥她，反而以后的资源不大好。（只是合理猜测，不站队，杠精勿扰）
353,yamy 敢这么发，要么找好下家了，没有门路相当于把自己的前途给毁了，而且这种类型的录音被爆，她以后的合作对象k可能会缺乏信任，至于老板，资本方的常态了吧
354,我被网上的消息骗多了，不敢轻易站队了，再等等看吧
355,艺人就是商品。
356,谁都不站，昨天看完道歉信，会觉得徐在威胁人，本来倒向了yamy，但今天看完这个，u1s1，徐老板还挺刚，在这种舆论下还能坚持住不道歉，我就觉得中间是不是还有什么我们不知道的？等着走法律途径我觉得会比较好
357,同感…………真的
358,目前为止，一个没遵守职场规则，一个没尊重女性，反正吃瓜中
359,还是请一个侦察队，两边询问吧，这种事总觉得不简单，各有各的理
360,今天跟朋友吃饭，人家搞爱豆的，说这录音被剪过……
361,老理中客了
362,+1
363,真的不懂，老有人精神资本家，精神老板，真的自己被剥削被压迫都不知道嘛
364,也不一定，可能还会说老女人睡不到鸭就急了急了两个一起骂
365,在这个父权社会里，女生有什么天然优势？？
366,开会录音某种程度上犯法了吧……
367,水命妍霏：这种私自录音是没有法律效用的，更何况是剪辑过的
368,犯法了……
369,作呕，你敢说你说的话不是真的？
370,你有被害妄想症？
371,海蓝时见鲸鱼lq：回复@奈良回忆录：在骂我就反弹，死一边去
372,海蓝时见鲸鱼lq：回复@奈良回忆录：嘴巴这么毒这么臭，祝你和她经历一样的事情还感同身受给人卖了还数钱
373,海蓝时见鲸鱼lq：回复@奈良回忆录：另外，死的那个也是你，说我杠的同时你自己不也在抬杠，你又是啥好东西。
374,我站老板会不会很惨
375,诶，我也是这样想的
376,会被骂，但是中立挺好的
377,保持吃瓜
378,@墨鱼爱咬人 中立+1
379,回复@perachaya_yaya那你别来评论我滚呢
380,校长有时候骂老师都跟骂孙子是的。
381,骂你
382,你们之间发生了什么我们不知道，所以作为大众没法说，也不予评价。就录音内容而言，侮辱人是事实，发俩次长篇大论都没有一句道歉。
383,这样看来是那女的不会做人
384,打官司吧
385,而且还自称职场PUA……一副自己很牛逼的样子，不知道在家会不会PUA自己的孩子呢，真的，这人病的太严重了，不仅得看心还得看脑子
386,我.....也...........额。。
387,不这么说怎么给自己洗呀，是我我也不想被曝光啊，脸都丢尽了呢，好，暂且不论这些，不说真假，也不说剪辑了，就单说这两天这人发的东西吧，是不是有人格缺陷太明显了，我想心理医生应该会给你指点迷津的
388,都不是什么善茬。网友真好骗。人家发个东西就出来维护所谓的弱者了。也不想想，如果没有退路，谁会这么刚真天真。瓜都吃累了，看着就烦。（没有认为徐评论长相就是对的意思）
389,疯了吧这群人？？录音怎么就不对了？？yamy就应该被侮辱吗
390,对
391,莫经他人事，莫劝他人善。
392,侮辱人是不对，年轻人做事不顾后果 ，搞得怎么大的事，估计很难有公司敢要她，因为新公司也怕以后会不会被这样搞。
393,吐了，天然优势
394,两边都不是啥好的谁也不信，吃瓜吧
395,看到你这儿我笑了 女性居然有天然优势hhhhhh你在说什么浑话
396,我也中立
397,服了这货！这样解释就是你们继续我不怕你们骂的意思吧？
398,不管怎么说，我觉得那个女团的那个很有问题，虽然这个老板也有问题，私自录音可以告吗
399,一边倒的网络舆论…让我都不敢发言了…
400,鸭米想利用舆论不花钱解约 徐也确实素质低下 low穿地心 那个告密的员工我觉得就是单纯看不惯这老板的这种行为 最后能忍这么几个月也是能忍 换作是我会立刻公布出来
401,我不追星啊
402,中立是吃瓜的正确态度，没有问题，本来就一个巴掌拍不响的事儿，无需站队
403,艺人在娱乐公司的定位就是商品除非你能红起来摆脱公司安排，前期出道的艺人所走的路线都是经过包装，穿什么衣服做什么发型
404,支持支持
405,这个公关文稿我觉得写得怪成功的
406,齐木楠瓜：看来你也要被说服了
407,我觉得我比较有发言权，上一份工作，一个人干三人的活，老板当着我大力称赞，背着我却指责我做的文案不够实操性。当面答应加工资，表示早就考虑这个问题了，背着我告诉人事经理，我来的时间不满一年，不能加。后来我就辞职了，换新工作后，那个老板还打了好几个电话，表示希望我回去。但这种敬谢不敏。
408,你做人的底线你想过吗？情绪激动又不能解决问题还人身攻击，可以告你啊
409,现在评论理智多了，吃瓜群众也是怕了
410,不支持就要谴责！
411,只有利益
412,职场不都是这样。我们同事背后也经常吐槽老板
413,铁nt
414,杂食甜心：你不用自我介绍
415,？来洗了
416,中立＋1
417,各位看好了，给徐明朝说话的要么是800年不发一条微博的小号今天突然特别活跃要么就是干脆没一条微博的死号，或许这就是资本的力量吧
418,山地白月影：回复@徐天艺：和资本家共情你是也能享受到那种高高在上的姿态？所以才如此猴急又胡言乱语？你才需要好好扪心自问好好审视审视你自己吧！
419,徐天艺：回复@山地白月影：扪心自问两年前怎么当皇族出道的心里没数吗？你跟这种偷别人人生的人共情莫非你也是小偷？半斤对八两的俩人，愣让你说成了白莲花🤷‍♀️
420,山地白月影：回复@徐天艺：你这么激动干嘛？徐明朝小号啊你？我确实没有资本普通平头小老百姓一个，到是你们这种时时刻刻和资本家共情站在资本家角度说话的人，什么大人物啊给我见识见识呗？
421,原来玲花嫁了个这么个东西。。。你还怪别人录音，本质是你到底有没有侮辱你的员工！时至今日还在批判别人给你录音！不知悔改！以后应该不会再有艺人签约他们家了吧
422,老板火了 艺人毁了
423,洗的人也太多了吧，嘴臭就是嘴臭，侮辱就是侮辱，不是说不被爆出来就不嘴臭，就不构成侮辱
424,老板骂人确实不对，他会议开始前就不准录音应该也知道自己的话不好听会得罪人。但看老板的信，感觉他骂人是先抑后扬，先说“吃藕”再夸酷，总结风格找准方向，也是为了以后发展。嗯为了解约录音发布也确实心机。两方都不简单吧，咱们路人吃瓜就好
425,你不会被骂 会被表扬 网友跟风太严重了 终于看到个三观不歪的
426,同意
427,你还真说错了，艺人在工作的环境下就是商品，至于什么是工作什么是生活，要动脑子想一下。
428,老行当出了新状况。
429,矛盾从老板侮辱职员转移到艺人损害他人利益，骂战从骂他转到骂网友。
430,+1
431,扭转舆论风向一套一套的，你们怎么不去死啊
432,重力吃瓜
433,终于找到和我想的差不多的了  一开始我就是这样想的
434,淦！这层楼的三观惊到我
435,就是出了口恶气，别的啥用没有。对后面解约打官司一点帮助也没有，该赔多少钱还是要陪，说不定还要涨，和公司这样干下家要怎么看你，以后要不要防着你，too young....
436,说实话昨天录音一出来第一感觉就是这个老板太不尊重人了，然后感觉艺人随便什么都能拿到网上，想没想过给她音频的那个人会是什么处境，不管开会的有多少人没有不透风的墙，以后肯定在公司待不下去了，所以我跟你一样中立
437,是啊是啊
438,有人说yamy 就是想解约了才曝光的
439,炼奶小馒头·_·：哎 中立🙋🏻
440,有钱一起赚啊兄弟，如果你是中立你就不会发这个评论了
441,艺人不是商品？艺人是人，更是商品，两者不冲突。
442,都不是什么好人，咱们吃瓜看戏得了
443,借此先发制人搞舆论就大可不必了吧，没多高级
444,莽原奔愿：回复@杂食甜心：录音被剪辑过，既然能提前录音，也能想好如何把录音利用最大化。我没有觉得他骂人是对，没有觉得她被骂是活该，错归错，理归理，背后被人骂，反过来她也学了放录音，两人做法难道谁比谁高级吗？现实一点，这种放录音到网上的做法且不说对公司本身有一种不负责，难道以后她还会被其他公司所接受吗？
445,杂食甜心：舆论见不得人？
446,气笑了 说这话的貌似还是性别女 阻碍国内feminist movement的人一半都是这种吧 不会好了
447,其实说白了，就是想解约，制造舆论。逼迫
448,这女的太没品了，公司内部事情敢这样搞，看以后哪个公司还敢收她，自己搞吧
449,我说实在的，以职场角度去说 这老板没啥错，因为艺人确实长相重要，这就像我领导当众说我业绩差 销量做的不好 为什么不好 等一样的 ，因为我做销售，所以如果我是明星老板这么说也没什么不对 会议就是要把一个比较“差的”拎出来说 就像读书老师也会说成绩差的等一些问题 说的都很直接都不好听 
450,她不想付违约金
451,就怕有下家。然后打官司一直拖给下家拖跑了。这就惨了
452,看网友各位路人一直说她和资本的对抗看一眼我都无聊，完全没搞清楚立场，错是错，理是理，拿道德情感伤害模糊动机后果大可不必，艺人终归是艺人，互相的底线，光扒一个人算怎么回事
453,一个靠吃软饭(自己背后的女人有钱），就混成了娱乐圈的老板了。真的以为自己是什么“大咖”啊？终究还会显原形的，吃相也很难看的。
454,两个人都不站，各有各的心思
455,荣耀定律？
456,女艺人是女性，但不是所有女性都是女艺人
457,从社会和情感角度来看艺人确实是人，但是从商业和资本角度来看艺人确实是商品，老板就算本意只是讨论y的商业价值，但是他说话确实难听，算得上侮辱。y把录音发出来想通过舆论施压来达到解约的目的也同样欠考虑，无论录音的人有没有同意她发出来，现实来说那人是一定没法在这个行业继续混了
458,娱乐圈就是那么回事。都是在演戏何必认真。
459,我是比较赞同你的看法呢！公司内部开会的语音怎么会被公开呢～真的心疼Yamy可以私下里安慰，这样的员工以后哪个公司敢要啊～
460,老板污辱公司职员为什么还有给点赞的呢？等有一天你们要是遇到这种情况会怎样？会说老板很对吗？
461,解约 掏钱走人 估计公司不会松口了 这个合约不太容易解掉 除非赔钱
462,这事在职场太常见了吧，就是一个人品不咋的的同事背后当着其他同事说你坏话，挑唆大家孤立你，这也算一种职场暴力吧，只不过不是明星被欺压才引起重视，哪个办公室没有这样爱背后嚼舌根的人呢
463,？别混淆视线模糊重点吧
464,月色很美风也温柔呀：回复@帅帅0266：从一开始不就是在说他公然人身攻击辱骂yamy？
465,帅帅0266：那重点是什么
466,意思就是，我背后骂你娘可以，但是你不能当所有人面骂我娘。你如果要骂，你偷摸找我，跟我对骂。但是对骂的时候，我还能抽你嘴巴子，你还不能还手。因为你欠我钱。哈哈哈
467,多少钱一条
468,又当又立
469,我想知道你们背后骂老板的时候呢？双标
470,你倒是事不关己高高挂起
471,奇迹晴妈：我只是做好了吃瓜路人的本职工作
472,有点没看懂
473,故意有人提这个问题让他回答，然后录完音留到现在…有一说一，这解约方法个人觉得不太光彩，但徐老板说话确实难听
474,为什么不能发跟几月份有几关吗？
475,这种事肯定理智吃瓜，这徐明朝说出这种话来人肯定是有问题，不是什么好鸟，但是yamy这波问题也很大啊。先不谈这个录音的人什么动机（个人认为录音的人是这个事件里最坏的B），但yamy这时候过了好几个月才把这个说出来就是想借助舆论压力赶快解约，估计也是有人指点，两边都不怎么样，还是理智吃瓜的好
476,都别想操纵舆论，观看就好。放出来大白天下很好
477,那你不想想这件事之后还有哪个老板敢要你吗
478,这种垃圾公司 垃圾领导 垃圾老板真的可以丢进乐色桶还吐点口水上去的那种 真的无下限不要脸 要是搁谁都受不了 真的心疼Yami 她在火箭是很暖心的队长
479,?优势 这么多人骂你，你感受到优势了吗?女性天然优势?
480,理性吃瓜，事情没有清楚之前不予评论。
481,是的，不站队，真相说不定会反转
482,你永远不知道真相是什么，所以不站队
483,本来就是pua 什么扯上 就是！还是恶劣的那种
484,暴躁的小胡同学：噗～和你这种没脑子的人说话太费劲了，学了个pua新词就开始套用，你知道什么是职场pua吗就开始站队？无知者无畏真挺可悲
485,我觉得想解约拿这个做筹码也没啥不可以~老板都这样了，想走也正常~
486,虽然但是，我看好多时候网友攻击女星长相的时候说的话也emmm吧，网暴别人的时候怎么不想想自己现在圣母的样子呢（声明：娱乐圈水太深我中立，我从来没在网上说过任何过分的话，别骂我，我骂不过玻璃心伤不起）
487,+1不偏不倚，毕竟我们都不知道实情，也同样不了解他们其中任何一个人，所以中立是最好的
488,就这事儿没有炒作的成分 我是不信的 大家都是为了各自利益 别给自己扣上道德高帽 谁也不比谁高贵 利益面前你我都是裸奔的无耻之徒
489,感觉有被冒犯到
490,为什么不可以爆出来
491,评论真是好有意思
492,本来是偏向一点yamy的，但现在看来事情并不简单 ，不多做评论，
493,就感觉。。很不简单，一直也没站队。
494,其实录音我听过了，我作为一个女生，是觉得这位老板评价的很客观（而且也不排除女方胡乱剪辑的可能）……因为老板是通过一个艺人的外貌来评价她的商业价值，而不是对她进行人身攻击。如果我觉得没啥不会被骂吧……
495,水很深 都走极端的话 没一个人是无辜的
496,不明真相所以中立是对的，以前我们公司有个员工，老板对她很看重，可是她私下签单，还伙同其他部门同事赚外快，后面被发现了，让她体面离职，而她却在外说公司各种不好，还挖客户。在外人看来，就是觉得她说的对，公司无情，但在公司的老员工才知道实情，不过领导不追究，小喽啰的我们也只是八卦。
497,有没有想过曝光之后，后续问题，还有哪个公司敢签约
498,中立加一，两边都有问题，一边倒是什么毛病
499,不清楚 不站队 安安静静吃个瓜就好了
500,我去  刚刚看了一部娱乐圈的剧，但是剧中的我还是能接受的，虽然经纪人会很累，但是投入多少总是会有回报的，你当人家是招牌，但你给人家的投入又是多少呢，人家给了你好的回报，就这样在背后议论别人真的不太好
501,中立吧
502,建议劳动仲裁
503,多少钱一条呀
504,说实话，这件事网友解决不了，别添火了
505,是不好看呀，
506,+1
507,同意，现在网友太容易被煽动
508,但是y也有别说人的不好呢，怎么老板不发出来
509,同意你
510,这层诅咒全部反弹真有意思中立都能被骂
511,➕1
512,我也加1，不觉得艺人有多委屈，但这种办法真的很low
513,我觉得网友不要一上来就骂，不要随便站队，网络暴力很恐怖的
514,顶你，对就是对，错就是错，
515,没有契约精神是应该开始被惩罚了！！一个巴掌拍不响！
516,一码是一码，居心叵测，不够善良就很不好。中立排队
517,我站在谁的角度，只是实话实说而已吧，觉得视频里的话并不有太大侮辱得成分，但确实本人听了会很难受，但是选择把录音爆出来难道真的不是为了解约别有用心吗，娱乐圈得水不是普通的我们能去勘探得
518,+1
519,我也是中立
520,观望也有错吗不站队就要死？现在新闻太多反转了。
521,这种因为劣势而带来的“优势”，希望您能多多享受
522,这种事多点爆出来才好！自己权益被侵犯藏着掖着有什么用！就是很多人不敢，才导致现在越来越多受害者被压着！yamy只是开了个头而已！希望以后受害者能大胆说出来！只要你没错，中国这么多人在你背后支持你，怕什么？
523,张雨绮也没被侮辱啊  她被骂的那么难听  如果有人这么骂你你也很难做到你说的这样吧…
524,pppCWL_：回复@捕风的Honey：你这么敢你别在营销号下面吃瓜啊 你去他们俩微博下面发表你的看法啊？？不是挺有自信的吗 一口一个契约精神 ？？这么牛逼还怕互联网风暴？
525,pppCWL_：回复@捕风的Honey：你自己不也没消停 ？你道德制高点挺高啊 自己也爬不上去吧？啊？？我寻思要不要请测量团队啊？无脑的家伙  我就觉得你说的不对咋滴了？？说话那么难听没少遭到社会的毒打吧？？
526,捕风的Honey：回复@pppCWL_：不认同你就消停会，我说我的观点，你出来瞎蹦跶什么，我觉得你还是当她的粉吧，你俩三观如此一致，要是你想解约，你老板不让，你也用这么龌龊的方法！你俩真挺像的！别回我啊，嫌你们这种人脏！
527,神他妈天然优势
528,不留证据你能承认？你理所当然，录音没错
529,不会 我也站中立
530,不会，我也中立
531,但他说的确实是实话
532,我也中立
533,老板的天然优势更大
534,女性的天然优势
535,有些人就是这样，一有风吹草动，就义愤填膺，你们到底知道什么？
536,感觉yamy也不是好人，这样也不好，理性吃瓜
537,你怎么不说老板用自己地位优势威胁她呢
538,先有人的底线再有职场的底线 人都没底线了，职场底线就是压迫他人的借口罢了
539,争青和木木：我寻思着这件事儿哪里触及到做人的底线了？是违法、违规还是反D反国了？
540,这个事都能上热搜，这些是工作的事拿出来说，这是你自己的事自己解决
541,+1不随便评论
542,评论看的触目惊心。感觉艺人也蛮可怜，对于我，领导对我不好我直接离职走人无所谓，而他们有合约还得赔付违约金🤷‍♀️要有契约精神，所以被经纪公司使劲欺负只能忍受不能反抗？反抗解约逃离魔窟就得赔付巨大违约金？这还是pua，这要是性骚扰呢？录音录像留证据是不是也会被路人骂没有契约精神？
543,呵呵
544,我也中立
545,我支持yamy，但是那个录音的同事实在有点。。。不知道怎么说
546,解约还是要走程序，发个录音是解不了约的。看看合同的解约条款。
547,我只知道在很现实的职场里，这种告密者或者录音者最后的下场都不太好
548,那时候火箭少女还在，爆出来对队友会有影响
549,生活中这种老板很常见啊，有的比这骂得更狠
550,娱乐圈就像浑浊的水。 真真假假，假假真真。
551,就跟某些主播流量大了后跳槽一个道理。女的职业道德有问题，男的素质有问题，双方确实都有问题
552,被控评了？？？
553,说实话，我顶你。我觉得未知全貌，不予置评。是对的
554,理性吃瓜
555,录音爆出来确实不太好吧
556,昨天看完热搜我心里就想说这话了，但是怕被骂，所以就🤐
557,没听过视频不知道啥内容，但是…现代职场员工说老板坏话，老板看不起员工嘲讽两句真的是很普遍的现象，当然我不知道老板说了啥过分的话，但是普通人如果把录音放出来应该没人关注吧
558,不知道谁对谁错，但是这个嚣张的态度，非常不利于获得群众舆论的支持
559,这种事情对双方都没什么好处，不知道目的是什么，不能轻易下结论
560,女性什么天然优势？跪久了？
561,我也
562,让我想起了大学里一个霸凌了别人还装无辜的同学
563,不管怎么样，攻击人外貌就是个很没品的事儿。这种人以后一定要见识见识，不然社会阅历都不丰富了
