,0
0,市长痛哭：你的死给我市带来的损失太大了，那个使用膝盖锁脖神功的混蛋警察，你下狠手时就不知道看看周围是不是有人在拍摄，你惹的祸可把我给整惨了。
1,感谢好友
2,谢谢好友
3,市长痛哭：你的死给我市带来的损失太大了，那个使用膝盖锁脖神功的混蛋警察，你下狠手时就不知道看看周围是不是有人在拍摄，你惹的祸可把我给整惨了。
4,谢谢好友
5,早上好
6,每日博闻：感谢好友
7,经常来互相转转呀
8,每日博闻：感谢来访
9,打卡
10,。。
11,演技不错。
12,特朗普，蓬呸呸都没哭，不算；
13,大哭？呵呵！这位官员做这套戏还假过（尉迟）要（程咬金）帮前主子哭丧！想不到现代真实版却发生在美国官界。哈哈！假到可怜。
14,资本国家是知道命比钱重要，为什么会这样？
15,美国政客都特么是演员吗？里根正宗演员转行；建国也算参演过奥斯卡获奖片，这家伙演技显然不俗。
16,...
17,鳄鱼的眼泪
18,演技派
19,黑人站起来统治美国，加油
20,表演，好莱坞来的吧
21,看到美国政客如此下作的表演，我感觉无法呼吸！
22,uuu
23,这市长真会做秀！
24,我
25,真情啊
26,人固有一死，或重于泰山，或轻于鸿毛，弗洛伊德虽然可能因为用假币而被抓，但死于美国白人的种族歧视，他的死就有了意义，也会象马丁路德一样被世人记住。
27,猫哭耗子
28,T：没人比我更懂什么是假新闻。
29,还真的能哭出来哎，天呐！
30,棺材质量真不错
31,为了选票我是真的拼了！
32,这黑人不是啥英雄，也不是干了光彩的事。用假钞，只是死的有点冤而已。用的着痛哭流涕了吗？
33,用户7413311124：你鉴定过是假炒？这都不重要，重要的是黑人不该死的
34,好演员。孝子贤孙
35,表演👍
36,为一个小偷，哭得像真的。。。
37,用户7413311124：小偷？你看见了吗？很混蛋的话
38,用户6787799887：你被弄死了狗都不理
39,是干嚎还是泪流满面
40,让犯罪的人得到应有惩处，让将来的执法变得公正透明，比哭灵好一百倍
41,show boat
42,如果没有游行示威，市长会参加吗？
43,被吓哭的，不哭要挨打
44,虽然是好莱坞出品，但剧情还是需要的。希望是好的
45,虽然特朗普骂他们软弱无能，但这位市长应当这样做。安抚民心、稳定局势是他的职责。
46,"为什么第一时间说是医疗事故,为什么第一时间只是解职?"
47,孔明：你这招我早用过了，你哭得那么差劲，比我差远了
48,追悼会都不忘做个秀。
49,猫哭耗子！
50,戏精
51,人权呢？
52,死去的黑人在棺材里露出灿烂的笑容
53,哈哈，哈哈。太戏，不像。
54,狗是假慈悲的
55,原来美国也兴这么哭灵
56,【黑人得了新冠：迷天大慌】为了减责，故意编造黑人已得新冠。在目前美国新冠疫情失控的环境下，“黑人得了新冠”很能让民众相信！
57,唉
58,猫哭老鼠
59,“明尼阿波利斯市市长雅各布·弗雷单膝跪在弗洛伊德的灵柩前，一手轻抚棺材，一手掩嘴痛哭”。 —— 一、该市长于灵前痛哭，应该是真实的情感流露；二、该市长应该是民主党人；三、若该市长为共和党人，于后特朗普会不会难为他、甚至攻击他？
60,市长是个好演员
61,感觉是:老鼠哭猫.
62,戏精！装的一手好逼！但一不小心，跪姿和那个警察一样。
63,戏精
64,这对美国也许是好事，弗洛伊德事件也许能让美国警察在面对黑人时能有所顾忌吧
65,这位市长，演过了，演过了啊…………
66,早知今日，何必当初。赶快把杀人警察重判，还死者一个公道，平息抗议抗议人群。
67,想起了孔明吊唁周瑜那一出
68,但愿不再是鳄鱼的眼泪！！！
69,意思是：“啊，我的乌纱帽啊。”
70,用户2938164951：在美国热闹了老百姓，真心乌纱帽不保啊。
71,猫哭耗子假慈悲
72,都是表演艺术家
73,连死的时候也没吸上一口新鲜空气，真的是可怜啊
74,这个孙子，装一下还是正确的选择。不然呢？要知道的是，美国国内的骚乱已经到了很严重的地步，这个状态继续下去，美国可能会万劫不复！更加可怕的是，过急跳墙的话，美国有可能会发动战争转移国内矛盾，那个时候，对于整个世界都是灾难！！第三次世界大战，你以为很遥远吗？很可能，近在咫尺！
75,用户6787799887：那第三次大战到你家去打？
76,美国现代版的卧龙吊孝？！
77,弗洛伊德就是被跪死的，单膝跪在弗洛伊德的灵柩旁边实在给逝者家属添堵
78,一半脸儿哭，一半脸儿笑，是哭是笑只有我知道。
79,演，继续演。
80,"""对不起呀，兄弟，是我没管好我的手下呀……我也没想到你们的人会有这么厉害呀…………求你原谅我们一回吧…………哦唔 哦唔 …………拜托在那边帮我们跟上帝说说好话吧，请他宽恕我们吧…………哦呜…………哦呜…………别在让你们的人打砸抢了啊…………我实在坚持不下去了啊…………"""
81,天蓝色19：回复@用户6787799887：过讲过讲了啊，我可没有什么文凭啊。——只是“那些各种剧”里，都是这么演的！…………现在，咱只是看到了一个现实的罢了…………
82,用户6787799887：心理学学的不错
83,政客都是表演系毕业的
84,痛哭流涕表明他良心未泯，野蛮执法又是他教育属下不利、、美国的事说不清；民主吗，大概就这样了。
85,民主党都是戏精！
86,作秀
87,政客戏子
88,演技不错
89,应该让川普过来下跪！！！
90,历史总在进步，不管怎么说，美国的黑人具有法律上的平等权利，纳粹式的种族歧视已经被扫入历史垃圾堆！
91,不敢想象，发生在其他地方会是什么样子
92,拙劣的表演，都是些骗子
93,特朗普是脱口秀演员，而这些政客确实戏精，佩洛西、彭佩奥等政客粉墨登场，真是搞笑。。。。
94,政客的日常
95,鳄鱼的眼泪。。。。
96,美国的这些政客，全他妈是演员，操
97,恶心！
98,真情流露，人心都是想通的。
99,装腔作势，要不然黑人闹事，估计死了都没人搭理
100,奥斯卡影帝级别的表演
101,哎吖哈哈哈哈哈哈哈哈哈哈哈哈哈哈哈
102,一场运动，仅仅为一个死者讨了公道，而且哪怕是这一个人的公道还不确定是不是真的讨的回。做到这里，大概就是种族主义者能做出的妥协了。
103,这一跪，耐人寻味，老特看了（你这厮赶紧给我起来，别给老子丢人现眼）警察看了（这事和咱们没关系，都是那个小子一个人干的，求求你代表我们向全国人民谢个罪吧！求求放过我们吧）民众看了（总算有个明白是非的领导人，嘚，手中的选票要不就…）
104,估摸着这个市长是为自个哭的，因为他的城市全乱了
105,为平息矛盾的演出，不然真不知道怎样收场。
106,这一哭，前程似锦，善。
107,美国的社会结构造成的，改也难。原因是：一，个人持枪合法且普遍，使得警察执法时高度紧张，总想着“先发制人”。二，种族歧视偏见，看见黑皮肤就“有罪推定”。三，由于种族偏见和社会阶层固化，黑人家庭陷入了恶性循环，贫穷，失学，失业，犯罪，家庭解体，下一代又如此。
108,这个市长有作秀的嫌疑
109,做表面形式主义文章，不能解决种族歧视固疾。
110,这演得也太过分了吧，简直要让人虎躯一震
111,美国政客真会表演，奥斯卡影帝非你莫属了！
112,这警察威武，看那眼神，还有揣在裤兜里的手，整个动作好轻松
113,明尼阿波利斯可是民主党的地盘，这个弗雷市长从政治主张看是民主党人。
114,让我看看有没眼泪
115,也有可能是因为这个事儿导致美国这么大的动乱，还有川普的总统之位都要不保了，身为共和党人，哭吧哭吧不是罪
116,对于特蓬来说，选举第一，挣钱第一，其它都不是事。
117,啊！你小子可把我们害惨了呀！
118,我怎么感觉哭得那么假啊
119,无法挽回弗洛伊德的生命，不知道特朗普是否会为消除种族隔阂做点实际的事情
120,呵呵😒
121,既使是装的也很必要，可以缓解社会情绪，避免城市遭到更大破坏。
122,演演员不演员，形式不形式究竟做到那块了。
123,蓬佩奥是一个畜生！
124,猫哭耗子
125,也不见特没谱出来在推特上喷两句？
126,可谓好莱坞优秀演员……
127,如果他的死能唤醒人们对种族歧视的认识，唤醒人们对生命的敬畏，那么他的死也是有价值的。愿佛洛伊德在天堂能够看到这一切！愿天堂里生活无忧，愿天堂里都是欢歌笑语，一路走好！
128,感情真深厚啊，还特么哭了，装，接着装
129,所以美国还是没有变化！还是那个德行！
130,黑人社区理应得到公正！
131,"你瞧瞧,美国警察的眼神,美国警察特别坏！"
132,用户6787799887：白种人打心底里，瞧不起其他种族的人
133,表演！
134,丞相非在梦中，君乃在梦中矣
135,共和党都是一群戏精啊，两面三刀。
136,任一18637288066：回复@杨廷枝：在美国，啥党都一样，争权利，都会找对方毛病，都会说漂亮话，看当权后的事实！
137,杨廷枝：这个市长是民主党的
138,Pkintelligence：真是，戏精，虚伪得很
139,也只有白人的个头才能降住黑人，黄种人估计没戏。
140,我感觉是装的
141,御剑踏红尘的微博：上次第一时间发布会他也哭了，感觉知道自己惹事了，果然被炒了
142,钢芯铁钻：不游行，警察一点事没有。
143,麻麻最温柔：装的也得哭啊，怒火压不下去
144,装孙子！
145,替天行道hhw：这个人确实不是装的。
146,蓬佩奥，出来说两句，你个喷子
147,雪花梨：回复@飘一一然：闪闪闪。主子来咯。。这特么是假新闻next
148,飘一一然：狗出来有什么用，主子出来才行
